Name,Ticker,Date,Time,Event Type,Description,Domicile
Gopher Asset Management Co Ltd,0985347D CH,12/29/19,08:00:00 PM,CP,Gopher Asset Management (0985347D CH) - CIO William Ma : Bloomberg TV Interview,CHINA
SGMC Capital Pte Ltd,1533051D SP,12/23/19,10:00:00 PM,CP,SGMC Capital  (1533051D SP) - CEO Massimiliano Bondurri : Bloomberg TV Interview,SINGAPORE
Cumberland Advisors Inc,590420Z US,12/23/19,06:10:00 PM,CP,Cumberland Advisors Inc (590420Z US) - CIO David Kotok : Bloomberg TV Interview,UNITED STATES
UBS AG,UBSN SW,12/22/19,07:40:00 PM,CP,UBS (UBSN SW) - CIO Dominic Schnider : Bloomberg TV Interview,SWITZERLAND
AllianceBernstein Holding LP,AB US,12/18/19,05:40:00 PM,CP,ALLIANCEBERNSTEIN HOLDING (AB US )- Roy Maslen : Bloomberg TV interview,UNITED STATES
Mainstay Capital Management LL,8268006Z US,12/16/19,06:10:00 PM,CP,Mainstay Capital (8268006Z US)- CEO David Kudla : Bloomberg TV Interview,UNITED STATES
WeLab Ltd,1009315D HK,12/12/19,09:40:00 PM,CP,WeLab (1009315D HK) - CEO Simon Loong : Bloomberg TV Interview,HONG KONG
DBS Bank Ltd,1471Z SP,12/11/19,10:30:00 PM,CP,DBS Bank LTD (1471Z SP) -  VP And Economist Radhika Rao : BTV Interview,SINGAPORE
Bank Pictet & Cie Asia Ltd,0390677D SP,12/10/19,10:00:00 PM,CP,Pictet Wealth Management Asia (0390677D SP) - CIO David Gaug: Bloomberg TV Interview,SINGAPORE
Dymon Asia Capital Singapore P,0381417D SP,12/10/19,,CP,DYMON ASIA CAPITAL (0381417D SP)-CO-CIO Danny Yong: Bloomberg TV Interview,SINGAPORE
State Street Global Advisors I,69823Z US,12/09/19,08:00:00 PM,CP,State Street Global Advisors (69823Z US) -CIO Lori Heinel : Bloomberg TV Interview,UNITED STATES
Bank of East Asia Ltd/The,23 HK,12/09/19,07:10:00 PM,CP,BANK OF EAST ASIA LTD(23 HK)- CIO Pheona Tsang : Bloomberg TV Interview,HONG KONG
WisdomTree Investments Inc,WETF US,12/08/19,06:40:00 PM,CP,WisdomTree (WETF US) - CEO Jesper Koll: Bloomberg TV Interview,UNITED STATES
Whittier Trust Co,0289366D US,12/08/19,05:10:00 PM,CP,Whittier Trust (0289366D US) -CIO Sandip Baghat : Bloomberg TV Interview,UNITED STATES
Trip.com Group Ltd,TCOM US,12/05/19,06:40:00 PM,CP,Ctrip (CTRP US) - CEO Jane Sun: Bloomberg TV Interview,CHINA
Melco Resorts & Entertainment,MLCO US,12/04/19,09:10:00 PM,CP,Melco Resorts & Entertainment Limited (MLCO US) - Chairman & CEO Lawrence Ho : Bloomberg TV Interview,HONG KONG
SGMC Capital Pte Ltd,1533051D SP,11/28/19,10:00:00 PM,CP,SGMC Capital  (1533051D SP) - CEO Massimiliano Bondurri : Bloomberg TV Interview,SINGAPORE
Conning & Co,9279Z US,11/27/19,09:00:00 PM,CP,CONNING & CO(9279Z US )-CIO Siew Mee Yeo: Bloomberg TV Interview,UNITED STATES
Oversea-Chinese Banking Corp L,OCBC SP,11/26/19,,CP,OCBC (OCBC SP) - CEO Samuel Tsien : Bloomberg TV Interview,SINGAPORE
Oversea-Chinese Banking Corp L,OCBC SP,11/25/19,,CP,OCBC (OCBC SP) - CEO Samuel Tsien : Bloomberg TV Interview,SINGAPORE
Sunway Bhd,SWB MK,11/21/19,10:30:00 PM,CP,SUNWAY BHD (SUNWAY BHD) - Chairman Jeffrey Cheah : Bloomberg TV Interview,MALAYSIA
Huaxing Growth Capital,RENSCZ CH,11/21/19,09:30:00 PM,CP,China Renaissance (RENSCZ CH) - Chairman and CEO Fan Bao : Bloomberg TV  Interview,CHINA
Anheuser-Busch InBev SA/NV,ABI BB,11/21/19,05:00:00 AM,CP,Anheuser-Busch InBev SA/NV (ABI BB) - CEO Carlos Brito : Bloomberg TV Interview,BELGIUM
Prudential PLC,PRU LN,11/21/19,04:00:00 AM,CP,Prudential PLC (PRU LN) - CEO Mike Wells : Bloomberg TV Interview,BRITAIN
Micron Technology Inc,MU US,11/21/19,02:00:00 AM,CP,Micron Technology (MU US) - CEO Sanjay Mehrotra : Bloomberg TV Interview,UNITED STATES
Goldman Sachs Group Inc/The,GS US,11/21/19,01:30:00 AM,CP,Goldman Sachs (GS US) - Chairman & CEO David Solomon : Bloomberg TV Interview,UNITED STATES
3M Co,MMM US,11/21/19,01:00:00 AM,CP,3M Co (MMM US) - CEO Mike Roman : Bloomberg TV Interview,UNITED STATES
Ayala Corp,AC PM,11/20/19,10:00:00 PM,CP,Ayala Corp (AC PM) - Chairman and CEO Jaime Augusto ZÃ³bel de Ayala : Bloomberg TV Interview,PHILIPPINES
Hang Lung Group Ltd,10 HK,11/20/19,09:30:00 PM,CP,Hang Lung Group (10 HK) - Chairman Ronnie Chan : Bloomberg TV Interview,HONG KONG
UBS AG,UBSN SW,11/20/19,09:00:00 PM,CP,UBS (UBSN SW) - CEO Sergio Ermotti : BTV Interview,SWITZERLAND
Standard Chartered PLC,STAN LN,11/20/19,07:00:00 PM,CP,Standard Chartered (STAN LN) - CEO Bill Winters: BTV Interview,BRITAIN
Cumberland Advisors Inc,590420Z US,11/20/19,05:10:00 PM,CP,Cumberland Advisors Inc (590420Z US) - CIO David Kotok : Bloomberg TB Interview,UNITED STATES
Best Mart 360 Holdings Ltd,2360 HK,11/19/19,,CP,BEST MART 360 HOLDINGS LTD(2360 HK) - CEO Hui Chi Kwan: Bloomberg TV Interview,HONG KONG
Credit Suisse Group AG,CSGN SW,11/18/19,09:00:00 PM,CP,Credit Suisse (CSGN SW) - CIO John Woods: Bloomberg TV Interview,SWITZERLAND
Yoma Strategic Holdings Ltd,YOMA SP,11/15/19,,CP,YOMA STRATEGIC HLDGS LTD(YOMA SP)- Executive Chairman Serge Pun: Bloomberg TV Interview,SINGAPORE
Ayala Corp,AC PM,11/15/19,,CP,Ayala Corp (AC PM) - Chairman and CEO Jaime Augusto Zobel de Ayala : Bloomberg TV Interview,PHILIPPINES
DBS Bank Ltd,1471Z SP,11/13/19,10:30:00 PM,CP,DBS Bank LTD (1471Z SP) -  VP And Economist Radhika Rao : BTV Interview,SINGAPORE
State Bank of India,SBIN IN,11/13/19,,CP,State Bank of India (SBIN IN) - Chairman Rajnish Kumar : Bloomberg tv Interview,INDIA
Coface SA,COFA FP,11/12/19,10:00:00 PM,CP,Coface SA (COFA FP) - CEO Xavier Durand : Bloomberg tv interview,FRANCE
Aplikasi Karya Anak Bangsa PT,1379371D IJ,11/11/19,10:10:00 PM,CP,GoPay  (1379371D IJ) - CEO  Aldi Haryopratomo  : Bloomberg TV Interview,INDONESIA
TransferWise Ltd,0777864D LN,11/11/19,09:10:00 PM,CP,Transferwise ltd (0777864D LN) - CEO & Co-Founder Kristo Kaarmann : BTV Interview,BRITAIN
THC Global Group Ltd,THC AU,11/11/19,05:40:00 PM,CP,THC GLOBAL GROUP LTD(THC AU)- CEO Ken Charteris : Bloomberg TV Interview,AUSTRALIA
HSBC Holdings PLC,HSBA LN,11/11/19,01:40:00 AM,CP,HSBC (HSBA LN)- COO Andy Maguire : BTV Interview,BRITAIN
Ping An Insurance Group Co of,2318 HK,11/10/19,11:40:00 PM,CP,PING AN INSURANCE GROUP (2318 HK)- CEO Jessica Tan : Bloomberg TV Interview,CHINA
DBS Group Holdings Ltd,DBS SP,11/10/19,10:50:00 PM,CP,DBS Group Holdings Ltd(DBS SP) CEO Piyush Gupta : Bloomberg TV Interview,SINGAPORE
DBS Bank Ltd,1471Z SP,11/10/19,10:50:00 PM,CP,DBS Bank LTD (1471Z SP) - CEO Piyush Gupta : BTV Interview,SINGAPORE
TransferWise Ltd,0777864D LN,11/10/19,10:40:00 PM,CP,Transferwise ltd (0777864D LN) - & Co-Founder Kristo Kaarmann : BTV Interview,BRITAIN
Twitter Inc,TWTR US,11/10/19,10:00:00 PM,CP,TWITTER INC (TWTR US) - VP & MD Maya Hari : Bloomberg TV Interview,UNITED STATES
LinkedIn Corp,LNKD US,11/07/19,10:30:00 PM,CP,LinkedIn (LNKD US) - MD & VP Olivier Legrand : Bloomberg TV Interview,UNITED STATES
Orix Corp Europe NV,115120Z NA,11/07/19,08:30:00 PM,CP,Robeco Groep (115120Z NA) - CIO Arnout Van Rijn: BTV Interview,NETHERLANDS
Mizuho Financial Group Inc,8411 JP,11/07/19,07:10:00 PM,CP,MIZUHO FINANCIAL GROUP INC(8441 JP) - VP Serena Zhou : Bloomberg TV Interview,JAPAN
Globe Telecom Inc,GLO PM,11/06/19,10:10:00 PM,CP,Globe Telecome (GLO PM) - CEO Ernest Cu : BTV Interview,PHILIPPINES
New Frontier Health Corp,NFH US,11/06/19,08:30:00 PM,CP,NEW FRONTIER CORP - A (NFC US) - CEO  Carl Wu : Bloomberg TV Interview,HONG KONG
AirAsia Group Bhd,AAGB MK,11/04/19,,CP,AirAsia Group (AAGB MK) - CEO Tony Fernandes  : BTV Interview,MALAYSIA
UBS AG,UBSN SW,11/03/19,08:00:00 PM,CP,UBS (UBSN SW) - CIO Yifan Hu : BTV Interview,SWITZERLAND
Geopolitical Futures LLC,1426380D US,10/30/19,10:30:00 PM,CP,Geopolitical Futures (1426380D US) - Founder George Friedman : BTV Interview,UNITED STATES
Prologis Inc,PLD US,10/30/19,08:40:00 PM,CP,Prologis (PLD US) - CEO Hamid Moghadam : Bloomberg TV Interview,UNITED STATES
Facebook Inc,FB US,10/30/19,06:20:00 PM,CP,Facebook (FB US) - COO Sheryl Sandberg: BTV Interview,UNITED STATES
Trip.com Group Ltd,TCOM US,10/30/19,,CP,Ctrip (CTRP US) - CEO Jane Sun: Bloomberg TV Interview,CHINA
Abbot Downing Investment Advis,1298277D US,10/29/19,07:10:00 PM,CP,Abbot Downing Investments (1298277D US) - CIO Carol Schleif : BTV Interview,UNITED STATES
Mainstay Capital Management LL,8268006Z US,10/29/19,06:10:00 PM,CP,Mainstay Capital (8268006Z US)- CEO David Kudla : BTV Interview,UNITED STATES
BC Technology Group Ltd,863 HK,10/28/19,10:10:00 PM,CP,BC Technology Group Ltd(863 HK)-Executive Director and OSL Chairman : BTV Interview,HONG KONG
Wynn Macau Ltd,1128 HK,10/28/19,,CP,Wynn Macau Ltd(1128 HK)- Vice Chairman and Executive Director Linda Chen: Bloomberg TV Interview,MACAU
SGMC Capital Pte Ltd,1533051D SP,10/28/19,12:00:00 AM,CP,SGMC Capital  (1533051D SP) - CEO Massimiliano Bondurri : BTV Interview,SINGAPORE
Geo Securities Ltd,1389784D HK,10/27/19,10:30:00 PM,CP,Geosecurities LTD (1389784D HK) - CEO Francis Lun : BTV Interview,HONG KONG
Council of The Americas Inc,0701928D US,10/27/19,08:30:00 PM,CP,Council of The Americas Inc(0701928D US)- VP Eric Farnsworth : Bloomberg TV Interview,UNITED STATES
Bulgari SpA,BUL IM,10/25/19,,CP,Bulgari SpA (BUL IM) - CEO Jean-Christophe Babin: BTV Interview,ITALY
APCO Worldwide LLC,517010Z US,10/24/19,11:30:00 PM,CP,APCO Worldwide (517010Z US) - CEO Brad Staples : Bloomberg TV Interview,UNITED STATES
Bank of Singapore Ltd,7595027Z SP,10/24/19,11:00:00 PM,CP,Bank of Singapore (7595027Z SP) - CIO Rajeev De Mello : BTV Interview,SINGAPORE
Intel Corp,INTC US,10/24/19,08:40:00 PM,CP,INTEL CORP (INTC US)- CEO  Bob Swan: Bloomberg TV Interview,UNITED STATES
JPMorgan Chase & Co,JPM US,10/22/19,08:10:00 PM,CP,JPMorgan Asset Management - CIO Bob Michele : Bloomberg TV Interview,UNITED STATES
Ant Group Co Ltd,1051260D CH,10/18/19,,CP,Ant Financial Services (1051260D CH) CEO Eric Jing- : BTV Interview,CHINA
Accor SA,AC FP,10/17/19,09:40:00 PM,CP,Accor SA (AC FP) - CEO Sebastien Bazin: BTV Interview,FRANCE
Indorama Ventures PCL,IVL TB,10/16/19,11:30:00 PM,CP,Indorama Ventures (IVL TB) - CEO Aloke Lohia : Bloomberg TV Interview,THAILAND
Sing Tao News Corp Ltd,1105 HK,10/16/19,07:40:00 PM,CP,Sing Tao News Corp Ltd (1105 HK) - Chairman Charles Ho : Bloomberg TV Interview,HONG KONG
GAW Capital Advisors Ltd,0077515Z HK,10/15/19,11:30:00 PM,CP,Gaw Capital (0077515Z HK) - Chairman/Co-Founder Goodwin Gaw : BTV Interview,HONG KONG
Northern Trust Corp,NTRS US,10/15/19,07:10:00 PM,CP,Northern Trust (NTRS US) - CIO/Exec VP Bob Browne : Bloomberg TV Interview,UNITED STATES
Tech Mahindra Ltd,TECHM IN,10/14/19,11:45:00 PM,CP,TECH MAHINDRA LTD(TECHM IN) - CEO CP Gurnani : Bloomberg TV Interview,INDIA
EuroEyes International Eye Cli,1846 HK,10/14/19,10:00:00 PM,CP,EuroEyes International Eye Clinic Ltd (1846 HK)- CEO Jorn Slot Jorgensen : Bloomberg TV Interview,GERMANY
Deutsche Bank AG,DBK GR,10/14/19,09:00:00 PM,CP,Deutsche AM (DBK GR) - APAC CIO Tuan Huynh : Bloomberg TV Interview,GERMANY
Hard Rock Cafe International I,6514Z US,10/13/19,08:50:00 PM,CP,Hard Rock Cafe (6514Z US) - Internatinal Asia CEO Edward Tracy : BTV Interview,UNITED STATES
American International Group I,AIG US,10/10/19,09:00:00 PM,CP,AMERICAN INTERNATIONAL GROUP (AIG US) - CIO Mark Konyn : Bloomberg TV Interview,UNITED STATES
JPMorgan Chase Bank NA,8147Z US,10/09/19,09:40:00 PM,CP,PMorgan Chase Bank NA (8147Z US) CEO - Mark Leung   : BTV Interview,UNITED STATES
Mainstay Capital Management LL,8268006Z US,10/09/19,07:10:00 PM,CP,Mainstay Capital (8268006Z US)- CEO David Kudla : BTV Interview,UNITED STATES
DBS Bank Ltd,1471Z SP,10/07/19,11:00:00 PM,CP,DBS BANK LTD ( 1471Z SP)- Wey Fook Hou : Bloomberg TV Interview,SINGAPORE
Ecognosis Advisory Co Ltd,1334081D HK,10/03/19,10:00:00 PM,CP,Ecognosis Advisory (1334081D HK) - CEO Andrew Freris: BTV Interview,HONG KONG
SGMC Capital Pte Ltd,1533051D SP,10/02/19,12:00:00 AM,CP,SGMC Capital  (1533051D SP) - CEO Massimiliano Bondurri : BTV Interview,SINGAPORE
Sierra Investment Management I,3855980Z US,10/01/19,07:10:00 PM,CP,Sierra Investment Management (3855980Z) - CIO Theresa Spath : BTV Interview,UNITED STATES
UBS AG,UBSN SW,09/29/19,11:00:00 PM,CP,(UBSN SW) - CIO Kelvin Tay : BTV Interview,SWITZERLAND
UBS China Ltd,0919365D CH,09/26/19,11:30:00 PM,CP,UBS China (0919365D CH) - President Eugene Qian : Bloomberg TV Interview,CHINA
International Air Transport As,280456Z CN,09/25/19,06:30:00 PM,CP,IATA (280456Z CN) - CEO Alexandre De Juniac  : Bloomberg TV Interview,CANADA
Goldman Sachs Group Inc/The,GS US,09/24/19,10:00:00 PM,CP,Goldman Sachs (GS US) - COO John Waldron: Bloomberg TV Interview,UNITED STATES
UBS AG,UBSN SW,09/23/19,09:00:00 PM,CP,UBS (UBSN SW) - CIO Yifan Hu : BTV Interview,SWITZERLAND
Abbot Downing Investment Advis,1298277D US,09/23/19,06:10:00 PM,CP,Abbot Downing Investments (1298277D US) - CIO Carol Schleif : BTV Interview,UNITED STATES
Godrej Properties Ltd,GPL IN,09/22/19,10:30:00 PM,CP,GODREJ PROPERTIES LTD (GPL IN)- Chairman  Adi Godrej : BTV Interview,INDIA
Verizon Communications Inc,VZ US,09/19/19,09:40:00 PM,CP,VERIZON COMMUNICATIONS INC ( VZ US )- Exec VP/CEO Guru Gowrappan: BTV Interview,UNITED STATES
Dimensional Fund Advisors LP,2853928Z US,09/19/19,08:40:00 PM,CP,"Dimensional Fund Advisors (2853928Z US) - CEO,Asia ex-Japan Peng Chen : BTV Interview",UNITED STATES
Formula One Management Ltd,1447042Z LN,09/18/19,11:50:00 PM,CP,Formula One Mana (1447042Z LN) - Chairman & CEO Chase Carey : BTV Interview,BRITAIN
SM Investments Corp,SM PM,09/18/19,11:30:00 PM,CP,SM Investments (SM PM) - Vice Chair Teresita Sy-Coson : Bloomberg TV Interview,PHILIPPINES
Barings LLC,318944Z US,09/18/19,11:00:00 PM,CP,Barings (318944Z US) - CEO Tom Finke : BTV Interview,UNITED STATES
Tiffany & Co,TIF US,09/18/19,08:00:00 PM,CP,TIFFANY & CO (TIF US) - CEO Alessandro Bogliolo : BTV Interview,UNITED STATES
Milken Institute,17268Z US,09/18/19,07:10:00 PM,CP,Milken Institute (17268Z US) - Chairman Mike Milken : Bloomberg TV Interview,UNITED STATES
Geo Securities Ltd,1389784D HK,09/17/19,09:40:00 PM,CP,Geosecurities LTD (1389784D HK) - CEO Francis Lun : BTV Interview,HONG KONG
Blackstone Group Inc/The,BX US,09/17/19,06:00:00 PM,CP,Blackstone Group (BX US) - Vice Chairman Tony James : Bloomberg TV Interview,UNITED STATES
Credit Suisse Group AG,CSGN SW,09/16/19,10:00:00 PM,CP,Credit Suisse (CSGN SW) - CIO of Asia-Pacific John Woods : BTV Interview,SWITZERLAND
Bank of Montreal,BMO CN,09/16/19,07:10:00 PM,CP,Bank of Montreal (BMO CN) - VP Jon Hill : BTV Interview,CANADA
Primavera Capital Ltd,0895278D HK,09/15/19,11:00:00 PM,CP,Primavera Capital Group (0895278D HK) - Chairman Fred Hu : BTV Interview,HONG KONG
Deutsche Bank AG,DBK GR,09/11/19,11:00:00 PM,CP,Deutsche AM (DBK GR) - APAC CIO Tuan Huynh : Bloomberg TV Interview,GERMANY
Amata Corp PCL,AMATA TB,09/10/19,10:30:00 PM,CP,AMATA CORP PUBLIC CO LTD (AMATA TB)- CEO Lena Ng : Bloomberg TV Interview,THAILAND
AirAsia Group Bhd,AAGB MK,08/29/19,10:10:00 PM,CP,AirAsia Group (AAGB MK) - CEO Tony Fernandes  : BTV Interview,MALAYSIA
Sansiri PCL,SIRI TB,08/28/19,11:30:00 PM,CP,Sansiri (SIRI TB) - CEO Apichart Chutrakul : Bloomberg TV Interview,THAILAND
Fortescue Metals Group Ltd,FMG AU,08/28/19,06:10:00 PM,CP,Fortescue Metals (FMG AU) - CEO Elizabeth Gaines : Bloomberg TV Interview,AUSTRALIA
Ecognosis Advisory Co Ltd,1334081D HK,08/27/19,11:00:00 PM,CP,Ecognosis Advisory (1334081D HK) - CEO Andrew Freris: BTV Interview,HONG KONG
Yes Bank Ltd,YES IN,08/25/19,11:30:00 PM,CP,Yes Bank (YES IN) - Senior President Shubhada Rao : Bloomberg TV Interview,INDIA
Consumer Technology Associatio,3418829Z US,08/25/19,08:00:00 PM,CP,Consumer Technology Association (3418829Z US) - CEO Gary Shapiro: BTV Interview,UNITED STATES
UTI International Singapore Pt,1046142Z SP,08/22/19,11:30:00 PM,CP,UTI International (1046142Z SP) - CEO Praveen Jagwani : Bloomberg TV Interview,SINGAPORE
JPMorgan Chase & Co,JPM US,08/22/19,07:00:00 PM,CP,JPMorgan Chase (JPM US) - Chairman Jacob Frenkel : BTV Interview,UNITED STATES
a2 Milk Co Ltd/The,ATM NZ,08/20/19,06:30:00 PM,CP,A2 MILK CO LTD ( ATM NZ) : CEO Jayne Hrdlicka : BTV Interview,NEW ZEALAND
Woodside Petroleum Ltd,WPL AU,08/19/19,01:45:00 AM,CP,Woodside Petroleum (WPL AU) - CEO Peter Coleman: BTV Interview,AUSTRALIA
Kotak Mahindra Asset Managemen,570619Z IN,08/18/19,11:30:00 PM,CP,Kotak Mahindra (570619Z IN) -Asset Management  CEO Lakshmi Iyer BTV Interview,INDIA
BlueScope Steel Ltd,BSL AU,08/18/19,09:45:00 PM,CP,Bluescope (BSL AU) - CEO Mark Vasella: BTV Interview,AUSTRALIA
Newcrest Mining Ltd,NCM AU,08/18/19,08:15:00 PM,CP,NEWCREST MINING LTD ( NCM AU )- CEO Sandeep Biswas BTV Interview,AUSTRALIA
DBS Bank Ltd,1471Z SP,08/12/19,11:30:00 PM,CP,DBS Bank LTD (1471Z SP) -  VP Economist Radhika Rao : BTV Interview,SINGAPORE
Bain & Co Inc,19963Z US,08/12/19,08:40:00 PM,CP,BAIN&CO INC (19963Z US) - VP Gerry Mattios : BTV Interview,UNITED STATES
Lan Kwai Fong Holdings Ltd,N.A. N.A.,08/11/19,10:00:00 PM,CP,Lan Kwai Fong Holdings (0103497D HK) - Chairman Allan Zeman: BTV Interview,HONG KONG
Credit Suisse Group AG,CSGN SW,08/08/19,11:00:00 PM,CP,Credit Suisse (CSGN SW) - CIO of Asia-Pacific John Woods : BTV Interview,SWITZERLAND
AMP Ltd,AMP AU,08/08/19,07:10:00 PM,CP,AMP (AMP AU) - CEO Francesco De Ferrari : BTV Interview,AUSTRALIA
Prudential PLC,PRU LN,08/07/19,08:30:00 PM,CP,PRUDENTIAL PLC (PRU LN) - CEO Mike Wells : Bloomberg TV Interview,BRITAIN
Cumberland Advisors Inc,590420Z US,07/31/19,07:10:00 PM,CP,Cumberland Advisors Inc (590420Z US)-CIO David Kotok:  BTV Interview,UNITED STATES
IMAX China Holding Inc,1970 HK,07/30/19,09:40:00 PM,CP,IMAX China (1970 HK) - CFO & COO Jim Athanasopoulos : BTV Interview,HONG KONG
Sezzle Inc,SZL AU,07/29/19,06:50:00 PM,CP,SEZZLE INC-CDI (SZL AU)- CEO Charlie Youakim  BTV Interview,UNITED STATES
Bank of Singapore Ltd,7595027Z SP,07/25/19,12:00:00 AM,CP,Bank of Singapore (7595027Z SP) - CIO Rajeev De Mello : BTV Interview,SINGAPORE
Union Bank of the Philippines,UBP PM,07/22/19,11:30:00 PM,CP,Union Bank of The Philippines (UBP PM) - Chairman Justo Ortiz Bloomberg TV Interview,PHILIPPINES
UBS AG,UBSN SW,07/18/19,09:30:00 PM,CP,UBS (UBSN SW) - CIO Greater China Yifan Hu : BTV Interview,SWITZERLAND
Bank Pictet & Cie Asia Ltd,0390677D SP,07/17/19,11:00:00 PM,CP,Pictet Wealth Management Asia (0390677D SP) - CIO David Gaug: BTV Interview,SINGAPORE
Loomis Sayles & Co LP,44450Z US,07/16/19,06:10:00 PM,CP,Loomis Sayles (44450Z US) - Vice Chairman Dan Fuss : Bloomberg TV Interview,UNITED STATES
Standard Life Aberdeen PLC,SLA LN,07/15/19,,CP,Standard Life Aberdeen (SLA LN) - Chairman Douglas Flint : Bloomberg TV Interview,BRITAIN
Dell Inc,1683997D US,07/14/19,07:40:00 PM,CP,Dell (DELL US) - CFO Tom Sweet : Bloomberg TV Interview,UNITED STATES
Kotak Mahindra Asset Managemen,570619Z IN,07/04/19,11:30:00 PM,CP,Kotak Mahindra (570619Z IN) - CIO of Fixed Income Lakshmi Iyer : BTV Interview,INDIA
Swiss Asia Capital Singapore P,0288023D SP,07/03/19,10:30:00 PM,CP,Swiss Asia Capital (0288023D SP) - CIO Juerg Kiener : BTV Interview,SINGAPORE
Suntory Holdings Ltd,SUNTZ JP,07/02/19,09:10:00 PM,CP,Suntory Holdings (SUNTZ JP) - President & CEO Takeshi Niinami: BTV Interview,JAPAN
Wells Fargo Asset Management C,1353412D US,07/02/19,07:10:00 PM,CP,Wells Fargo Asset Mngmt (1353412D US) - CEO Kirk Hartman: BTV Interview,UNITED STATES
Cumberland Advisors Inc,590420Z US,05/10/19,07:10:00 AM,CP,Cumberland Advisors (590420Z US)-CIO David Kotok:  BTV Interview,UNITED STATES
Morgan Stanley,MS US,04/09/19,10:00:00 PM,CP,Morgan Stanley (MS US) - Asia Economist Deyi Tan : Bloomberg TV Interview,UNITED STATES
JPMorgan Chase & Co,JPM US,04/09/19,07:10:00 PM,CP,JPMorgan Chase (JPM US) - Global Multi-Asset Strategist Patrik Schowitz : BTV Interview,UNITED STATES
Rogers Investment Advisors KK/,1297875D JP,03/31/19,07:40:00 PM,CP,Rogers Investment Advisors (1297875D JP)-CEO & CIO Ed Rogers : BTV Interview,JAPAN
AMP Capital Investors Ltd,838644Z AU,03/29/19,04:00:00 AM,CP,AMP Capital (838644Z AU)- Head of Dynamic Markets & Senior Portfolio Manager- Nader Naeimi: BTV Interview,AUSTRALIA
BNP Paribas SA,BNP FP,03/29/19,03:30:00 AM,CP,BNP Paribas SA (BNP FP)- Head of Equity Research: Abhiram Eleswarapu - BTV Interview,FRANCE
Harvest Global Investments Ltd,0341043D HK,03/28/19,10:30:00 PM,CP,Harvest Global Investments Ltd(0341043D HK) - CIO Thomas Kwan: BTV Interview,HONG KONG
UBS AG,UBSN SW,03/28/19,10:00:00 PM,CP,UBS (UBSN SW) -  CIO Office Head of Asia Asset Allocation: Adrian Zuercher: BTV Interview,SWITZERLAND
Daiwa Securities Group Inc,8601 JP,03/28/19,09:00:00 PM,CP,Daiwa Securities Group Inc (8601 JP) - Chief Strategist: APAC Equity Research Paul Kitney: BTV Interview,JAPAN
WM Motor Technology Co Ltd,1433488D CH,03/27/19,11:40:00 PM,CP,WM Motor (1433488D CH)-Chairman & CEO Freeman Shen  : BTV Interview,CHINA
Deutsche Bank AG,DBK GR,03/27/19,11:30:00 PM,CP,Deutsche AM (DBK GR) - APAC CIO Tuan Huynh : BTV Interview,GERMANY
AIA Group Ltd,1299 HK,03/27/19,09:00:00 PM,CP,AIA Group (1299 HK) - CIO Mark Konyn: BTV Interview,HONG KONG
Julius Baer Group Ltd,BAER SW,03/27/19,07:30:00 PM,CP,Julius Baer (BAER VX) - CEO Bernhard Hodler : BTV Interview,SWITZERLAND
Mainstay Capital Management LL,8268006Z US,03/27/19,06:10:00 PM,CP,Mainstay Capital (8268006Z US)- CEO David Kudla : BTV Interview,UNITED STATES
JPMorgan Chase & Co,JPM US,03/27/19,12:00:00 AM,CP,JPMorgan Chase (JPM US) - Executive Director & Head of FX Strategy for EM Asia Jonathan Cavenagh : BTV Interview,UNITED STATES
Modern Terminals Ltd,MODTLZ HK,03/26/19,10:40:00 PM,CP,Modern Terminals (MODTLZ HK) - CEO Peter Levesque : BTV Interview,HONG KONG
Saxo Bank A/S,367010Z SH,03/26/19,10:00:00 PM,CP,Saxo Bank (367010Z DC) - CIO & Chief Economist Steen Jakobsen : Bloomberg TV Interview,DENMARK
Fortescue Metals Group Ltd,FMG AU,03/26/19,07:40:00 PM,CP,Fortescue Metals (FMG AU) - Chairman Andrew Forrest : BTV Interview,AUSTRALIA
AMP Capital Investors Ltd,838644Z AU,03/14/19,12:00:00 AM,CP,AMP Capital (838644Z AU)- Head of Investment Strategy & Chief Economist Shane Oliver: BTV Interview,AUSTRALIA
BOC Aviation Ltd,2588 HK,03/13/19,10:30:00 PM,CP,BOC Aviation (2588 HK) - CEO Robert Martin: Bloomberg TV Interview,SINGAPORE
Mainstay Capital Management LL,8268006Z US,03/13/19,07:10:00 PM,CP,Mainstay Capital (8268006Z US)- CEO David Kudla : BTV Interview,UNITED STATES
Trip.com Group Ltd,TCOM US,03/13/19,06:15:00 PM,CP,Ctrip (CTRP US) - CEO Jane Sun: Bloomberg TV Interview,CHINA
UBS AG,UBSN SW,02/26/19,07:40:00 PM,CP,UBS (UBSN SW) - CIO Office Head of Equity Hartmut Issel : BTV Interview,SWITZERLAND
Genfit,GNFT FP,02/26/19,10:00:00 AM,CP,BI Analyst Briefing: NASH Expert Interview,FRANCE
Pfizer Inc,PFE US,02/26/19,10:00:00 AM,CP,BI Analyst Briefing: NASH Expert Interview,UNITED STATES
Allergan PLC,AGN US,02/26/19,10:00:00 AM,CP,BI Analyst Briefing: NASH Expert Interview,UNITED STATES
Novartis AG,NOVN SW,02/26/19,10:00:00 AM,CP,BI Analyst Briefing: NASH Expert Interview,SWITZERLAND
Intercept Pharmaceuticals Inc,ICPT US,02/26/19,10:00:00 AM,CP,BI Analyst Briefing: NASH Expert Interview,UNITED STATES
Gilead Sciences Inc,GILD US,02/26/19,10:00:00 AM,CP,BI Analyst Briefing: NASH Expert Interview,UNITED STATES
CLP Holdings Ltd,2 HK,02/25/19,07:15:00 PM,CP,CLP Holdings Limited  (2 HK) - CEO Richard Lancaster : BTV Interview,HONG KONG
Bank of Singapore Ltd,7595027Z SP,02/24/19,11:00:00 PM,CP,Bank of Singapore (7595027Z SP) - CIO Rajeev De Mello : BTV Interview,SINGAPORE
Deutsche Bank AG,DBK GR,02/24/19,10:00:00 PM,CP,Deutsche AM (DBK GR) - APAC CIO Tuan Huynh : BTV Interview,GERMANY
Vietnam Airlines JSC,HVN VN,02/24/19,09:30:00 PM,CP,Vietnam Airlines (HVN VN) - CEO Duong Tri Thanh : BTV Interview,VIETNAM
US China Business Council,0248243D US,02/24/19,08:00:00 PM,CP,US China Business Council (0248243D US) - VP Jacob Parker : BTV Interview,UNITED STATES
BlueScope Steel Ltd,BSL AU,02/24/19,07:45:00 PM,CP,Bluescope (BSL AU) - CEO Mark Vasella: BTV Interview,AUSTRALIA
Lenovo Group Ltd,992 HK,02/24/19,,CP,Lenovo (992 HK) - CFO Wong Wai Ming : BTV Interview,CHINA
Qantas Airways Ltd,QAN AU,02/20/19,06:30:00 PM,CP,Qantas (QAN AU) - CEO Alan Joyce : BTV Interview,AUSTRALIA
Credit Suisse Group AG,CSGN SW,02/19/19,11:00:00 PM,CP,Credit Suisse (CSGN SW) - CIO of Asia-Pacific John Woods : BTV Interview,SWITZERLAND
Fortescue Metals Group Ltd,FMG AU,02/19/19,09:30:00 PM,CP,Fortescue Metals (FMG AU) - CEO Elizabeth Gaines : BTV Interview,AUSTRALIA
a2 Milk Co Ltd/The,ATM NZ,02/19/19,05:30:00 PM,CP,A2 MILK CO LTD ( ATM NZ) : CEO Jayne Hrdlicka : BTV Interview,NEW ZEALAND
HSBC Holdings PLC,HSBA LN,02/18/19,11:45:00 PM,CP,HSBC (HSBA LN) CFO Ewen Stevenson : BTV Interview,BRITAIN
Oil Search Ltd,OSH AU,02/18/19,10:15:00 PM,CP,Oil Search (OSH AU) - CEO Peter Botten : BTV Interview,AUSTRALIA
UBS AG,UBSN SW,02/18/19,08:00:00 PM,CP,UBS (UBSN SW) - CIO Kelvin Tay : BTV Interview,SWITZERLAND
JP Morgan Asset Management Inc,0215978D US,02/18/19,05:10:00 PM,CP,JP Morgan Asset Management ( 0215978D US) : CIO Bob Michele : BTV Interview,UNITED STATES
DBS Bank Ltd,1471Z SP,02/18/19,12:00:00 AM,CP,DBS Bank LTD (1471Z SP) - CEO Piyush Gupta : BTV Interview,SINGAPORE
Woodside Petroleum Ltd,WPL AU,02/17/19,05:10:00 PM,CP,Woodside Petroleum (WPL AU) - CEO Peter Coleman: BTV Interview,AUSTRALIA
South32 Ltd,S32 AU,02/13/19,10:10:00 PM,CP,South32 (S32 AU) - CEO Graham Kerr : BTV Interview,AUSTRALIA
ASX Ltd,ASX AU,02/13/19,07:40:00 PM,CP,ASX (ASX AU) - CEO Dominic Stevens  : BTV Interview,AUSTRALIA
Globe Telecom Inc,GLO PM,02/11/19,09:40:00 PM,CP,Globe Telecome (GLO PM) - CEO Ernest Cu : BTV Interview,PHILIPPINES
Atlantis Investment Management,0288756Z HK,02/10/19,08:30:00 PM,CP,Atlantis IM (0288756Z HK) - Chairwoman & CIO Liu Yang: BTV Interview,HONG KONG
AGL Energy Ltd,AGL AU,02/07/19,05:40:00 PM,CP,AGL ENERGY LTD (AGL AU) - CEO Brett Redman : BTV Interview,AUSTRALIA
Amundi SA,AMUN FP,02/05/19,10:00:00 PM,CP,Amundi (AMUN FP) - CIO Pascal Blanque: BTV Interview,FRANCE
Union Bancaire Privee UBP SA,1073Z SW,02/03/19,11:00:00 PM,CP,Union Bancaire Privée (1073Z SW) - CIO Norman Villamin : BTV Interview,SWITZERLAND
