Name,Ticker,Date,Time,Event Type,Description,Domicile
Marathon Asset Management LP,4064694Z US,05/17/17,10:10:00 AM,CP,Marathon Asset Management LP (4064694Z US)-CEO Bruce Richards:BTV Interview,UNITED STATES
Morningstar Inc,MORN US,05/17/17,10:04:00 AM,CP,Morning Star (MORN US) - CEO Kunal Kapoor : BTV Interview,UNITED STATES
Green Plains Inc,GPRE US,05/17/17,08:40:00 AM,CP,Green Plains (GPRE US) - CEO Todd Becker : Bloomberg TV Interview,UNITED STATES
Lightyear Capital LLC,225962Z US,05/17/17,08:30:00 AM,CP,Lightyear Capital (225962Z US) - Chairman & Founder Don Marron : BTV Interview,UNITED STATES
Willett Advisors LLC,3624878Z US,05/17/17,08:00:00 AM,CP,Willett Advisors (3624878Z US) - Chairman Steve Rattner: BTV Interview,UNITED STATES
Pearson PLC,PSON LN,05/17/17,07:30:00 AM,CP,Pearson (PSON LN) - CEO John Fallon: BTV Interview,BRITAIN
International Air Transport As,280456Z CN,05/17/17,02:40:00 AM,CP,IATA (280456Z CN) - CEO Alexandre De Juniac  : Bloomberg TV Interview,CANADA
ABN AMRO Group NV,1728921D NA,05/17/17,02:15:00 AM,CP,ABN Amro (ABN NA) - CFO Kees Van Dijkhuizen : BTV Interview,NETHERLANDS
TransferWise Ltd,0777864D LN,05/16/17,05:00:00 PM,CP,Transferwise (0777864D LN) - Chairman Taavet Hinrikus: BTV Interview,BRITAIN
Morgan Stanley,MS US,05/16/17,04:00:00 PM,CP,Morgan Stanley (MS US) - CIO Rui De Figueiredo: BTV Interview,UNITED STATES
Adecoagro SA,AGRO US,05/16/17,11:30:00 AM,CP,Adecoagra (AGRO US) - CEO Mariano Bosch: Bloomberg TV Interview,ARGENTINA
Snap-on Inc,SNA US,05/16/17,07:30:00 AM,CP,Snap-On (SNA US) - CEO Nick Pinchuk  : Bloomberg TV Interview,UNITED STATES
Kavar Capital Partners LLC,1299529D US,05/16/17,,CP,Kavar Capital (1299529D US) - CEO Douglass Ciocca : BTV Interview,UNITED STATES
easyJet PLC,EZJ LN,05/16/17,03:30:00 AM,CP,EasyJet Plc (EZJ LN) - CEO Carolyn McCall: BTV Interview,BRITAIN
Aflac Inc,AFL US,05/15/17,02:30:00 PM,CP,Aflac Inc (AFL US)- CFO Frederick Crawford: BTV Interview,UNITED STATES
Phillips Auction House,76275Z FP,05/15/17,12:50:00 PM,CP,Phillips (76275Z FP) - Chairman & CEO Edward Dolman: BTV Interview,FRANCE
Karachi Stock Exchange Ltd,0140899D PA,05/15/17,12:30:00 AM,CP,Karachi Stock Exchange (0140899D PA) - CEO Nadeem Naqvi: BTV Interview,PAKISTAN
Razer USA Ltd,0112385D US,05/14/17,11:40:00 PM,CP,Razer (0112385D US) - CEO Min-Liang Tan: BTV Interview,UNITED STATES
PetroChina Co Ltd,857 HK,05/12/17,05:00:00 PM,CP,Petrochina Co Ltd (857 HK) Chairman-Wang Yilin: BTV Interview,CHINA
Massachusetts Institute of Tec,24608Z US,05/12/17,05:00:00 PM,CP,MIT (24608Z US) - Director CSAIL Daniela Rus: Bloomberg TV Interview,UNITED STATES
Deutsche Bank AG,DBK GR,05/12/17,12:30:00 PM,CP,Deutsche Bank AM (DBK GR) - Head of Real Estate Todd Henderson : BTV Interview,GERMANY
Federal Reserve Bank of Chicag,2972874Z US,05/12/17,10:30:00 AM,CP,Federal Reserve Bank of Chicago(2972874Z US)- P. Charles Evans : BTV Interview,UNITED STATES
Nomura Holdings Inc,8604 JP,05/12/17,08:10:00 AM,CP,Nomura (8604 JP) - Chief Economist Lewis Alexander: Bloomberg TV Interview,JAPAN
Allied Irish Banks PLC,ALBK ID,05/12/17,05:45:00 AM,CP,Allied Irish Bank (ALBK ID) - CEO Bernard Byrne: Bloomberg TV Interview,IRELAND
Irish Bank Resolution Corp Ltd,ANGL ID,05/12/17,05:45:00 AM,CP,BTV Interview: Chief Executive Office Bernard Byrne,IRELAND
Franklin Resources Inc,BEN US,05/12/17,04:00:00 AM,CP,Franklin Resources (BEN US) - Chairman Mark Mobuis: BTV Interview,UNITED STATES
Maersk A/S,0610405D US,05/11/17,10:20:00 PM,CP,Maersk Line (0610405D US) - APAC CEO Robbert Van Trooijen: BTV Interview,DENMARK
Asian Infrastructure Investmen,1369196D CH,05/11/17,10:10:00 PM,CP,AIIB (1369196D CH) President Jin Liqun: BTV Interview,CHINA
JPMorgan Chase & Co,JPM US,05/11/17,07:30:00 PM,CP,JPMorgan Chase (JPM US) - Chairman Jacob Frenkel : BTV Interview,UNITED STATES
AustralianSuper Pty Ltd,0278071D AU,05/11/17,06:10:00 PM,CP,AustralianSuper Pty (0278071D AU) - CEO/CIO Mark Delaney: BTV Interview,AUSTRALIA
General Electric Co,GE US,05/11/17,05:45:00 PM,CP,General Electric (GE US) - GE Ventures Head Susan Siegel: BTV Interview,UNITED STATES
nuTonomy Inc,1372863D US,05/11/17,05:20:00 PM,CP,nuTonomy (1372863D US) - CEO Karl Iagnemma: BTV Interview,UNITED STATES
General Electric Co,GE US,05/11/17,05:00:00 PM,CP,GE (GE US) - CFO Jeffrey Bornstein: BTV Interview,UNITED STATES
WPP PLC,WPP LN,05/11/17,11:15:00 AM,CP,WPP Plc (WPP LN) - CEO Martin Sorrell: BTV Interview,BRITAIN
Goldman Sachs & Co LLC,1903Z US,05/11/17,09:00:00 AM,CP,Goldman Sachs AM (1903Z US) - CIO Jonathan Beinner: BTV Interview,UNITED STATES
Barclays PLC,BARC LN,05/11/17,05:00:00 AM,CP,Barclays (BARC LN) - CEO Jes Staley: BTV Interview,BRITAIN
Standard Chartered PLC,STAN LN,05/11/17,02:30:00 AM,CP,Standard Chartered (STAN LN) - CEO:ASA Anna Mars - BTV Interview,BRITAIN
PTT PCL,PTT TB,05/11/17,02:00:00 AM,CP,PTT PCL (PTT TB) - CEO Tevin Vongvanich : Bloomberg TV Interview,THAILAND
Axiata Group Bhd,AXIATA MK,05/11/17,12:10:00 AM,CP,Axiata Group BHD (AXIATA MK) - CEO Jamaludin Ibrahim : BTV Interview,MALAYSIA
CIMB Group Sdn Bhd,CBB MK,05/10/17,11:45:00 PM,CP,CIMB BHD (CBB MK) - Chairman Nazir Razak: Bloomberg TV Interview,MALAYSIA
UBS Group AG,UBSG SW,05/10/17,11:10:00 PM,CP,UBS (UBS US) - CEO / APAC Joseph Chee: Bloomberg TV Interview,SWITZERLAND
GrabTaxi Holdings Pte Ltd,0967655D SP,05/10/17,10:10:00 PM,CP,Grab (0967655D SP) : Co-Founder Hooi Ling : Bloomberg TV Interview,SINGAPORE
Marriott International Inc/MD,MAR US,05/10/17,09:10:00 PM,CP,Marriott International (MAR US) - COO / Asia Rajeev Menon : BTV Interview,UNITED STATES
Goldman Sachs International,1671Z LN,05/10/17,09:10:00 PM,CP,Int'l Goldman Sachs AM (1671Z LN) - CEO Sheila Patel: BTV Interview,BRITAIN
Lloyds Banking Group PLC,LLOY LN,05/10/17,08:40:00 PM,CP,Lloyds (LLOY LN) - CEO / APAC Kent Chaplin: Bloomberg TV Interview,BRITAIN
iRobot Corp,IRBT US,05/10/17,05:45:00 PM,CP,iRobot (IRBT US) - CEO Colin Angle: BTV Interview,UNITED STATES
Koninklijke Ahold Delhaize NV,AD NA,05/10/17,02:20:00 PM,CP,Ahold NV (AH NA) - CEO Dick Boer: BTV Interview,NETHERLANDS
ING Bank NV,1111Z NA,05/10/17,01:20:00 PM,CP,ING Bank NV (1111Z NA) - CFO Koos Timmermans: BTV Interview,NETHERLANDS
AIA Group Ltd,1299 HK,05/09/17,11:10:00 PM,CP,AIA Group (1299 HK) - CIO Mark Konyn: BTV Interview,HONG KONG
Bluebird Bio Inc,BLUE US,05/09/17,05:45:00 PM,CP,Bluebird Bio (BLUE US) - CEO Nick Leschly: BTV Interview,UNITED STATES
United Parcel Service Inc,UPS US,05/09/17,03:10:00 PM,CP,United Parcel (UPS US) - CEO David Abney: BTV Interview,UNITED STATES
Aberdeen Asset Management PLC,ADN LN,05/09/17,01:30:00 PM,CP,Aberdeen Asset Management (ADN LN) - CEO Martin James Gilbert: BTV Interview,BRITAIN
WPP PLC,WPP LN,05/09/17,06:30:00 AM,CP,WPP Plc (WPP LN) - CEO Martin Sorrell: BTV Interview,BRITAIN
Commerzbank AG,CBK GR,05/09/17,06:00:00 AM,CP,Commerzbank (CBK GR) - CFO Stephan Engels: BTV Interview,GERMANY
Akamai Technologies Inc,AKAM US,05/08/17,05:20:00 PM,CP,Akamai Technologies (AKAM US) - CEO/Co-Founder Tom Leighton : BTV Interview,UNITED STATES
FTI Consulting Inc,FCN US,05/08/17,08:30:00 AM,CP,FTI Consulting INC (FCN US) - Chairman Renaud Dutreil : BTV Interview,UNITED STATES
Bain & Co Inc,19963Z US,05/08/17,07:40:00 AM,CP,BAIN&CO INC (19963Z US) - Chairman Olivier Marchal : BTV Interview,UNITED STATES
Publicis Groupe SA,PUB FP,05/08/17,06:00:00 AM,CP,Publicis Groupe (PUB FP) - Chairman Maurice Levy : BTV Interview,FRANCE
Moelis & Co,MC US,05/05/17,01:00:00 PM,CP,Moelis & Co.- Co-Vice Chairman Eric Cantor : BTV Interview,UNITED STATES
Makara Capital Partners Pte Lt,0289952D SP,05/05/17,11:40:00 AM,CP,Makara Capital Partners (0289952D SP) - CEO Ali Ahmad: BTV Interview,SINGAPORE
Willett Advisors LLC,3624878Z US,05/05/17,08:00:00 AM,CP,Willett Advisors (3624878Z US) - Chairman Steve Rattner: BTV Interview,UNITED STATES
Ant Group Co Ltd,1051260D CH,05/05/17,07:40:00 AM,CP,Ant Financial Services (1051260D CH) - President Doug Feagin: BTV Interview,CHINA
Vestas Wind Systems A/S,VWS DC,05/05/17,03:30:00 AM,CP,Vestas Wind Syst (VWS DC) - CEO Anders Runevad:BTV interview,DENMARK
Square Inc,SQ US,05/04/17,05:00:00 PM,CP,Square Inc. (SQ US) - CFO Sarah Friar: BTV Interview,UNITED STATES
Dunkin' Brands Group Inc,DNKN US,05/04/17,03:35:00 PM,CP,Dunkin' Brands (DNKN US) - CEO & Chairman Nigel Travis: BTV Interview,UNITED STATES
Crescent Capital Group LP,39733Z US,05/04/17,02:10:00 PM,CP,Cresent Cap (3656741Z LN) - Co-Founder Mark Attanasio : Bloomberg TV Interview,UNITED STATES
Stillwater Mining Co,SWC US,05/04/17,12:45:00 PM,CP,Stillwater Mining (SWC US)-CEO Michael McMullen : BTV Interview,UNITED STATES
Capital Economics Ltd,4471071Z LN,05/04/17,11:00:00 AM,CP,Capital Economics (4471071Z LN)-Executive Chairman Roger Bootle : BTV Interview,BRITAIN
Petroleos Mexicanos,1232Z MM,05/04/17,10:30:00 AM,CP,Pemex (1232Z MM) - CEO Antonio Gonzales Anaya : Bloomberg TV Interview,MEXICO
SL Green Realty Corp,SLG US,05/04/17,08:45:00 AM,CP,SL Green Reality (SLG US) CEO Marc Holliday: BTV Interview,UNITED STATES
BlackRock Financial Management,339788Z US,05/04/17,08:00:00 AM,CP,BlackRock Financial Management  (339788Z US ) - CIO Rick Rieder: BTV Interview,UNITED STATES
adidas AG,ADS GR,05/04/17,06:35:00 AM,CP,Adidas AG (ADS GR) - Chairman Kasper Rorsted : Bloomberg TV Interview,GERMANY
Vanguard Advisers Inc,3866404Z US,05/04/17,06:30:00 AM,CP,Vanguard Advisesrs (3866404Z US) - CEO & Chairman Bill McNabb : BTV Interview,UNITED STATES
UBS Asset Management Japan Ltd,UBSF JP,05/04/17,05:30:00 AM,CP,UBS AM (UBSF JP) - Global CIO Wealth Mngmnt Mark Haefele: BTV Interview,JAPAN
Orix Corp Europe NV,115120Z NA,05/03/17,11:10:00 PM,CP,Robeco Groep (115120Z NA) - CIO Arnout Van Rijn: BTV Interview,NETHERLANDS
Facebook Inc,FB US,05/03/17,05:00:00 PM,CP,Facebook (FB US) - COO Sheryl Sandberg: BTV Interview,UNITED STATES
Darktrace Ltd,1250307D LN,05/03/17,03:30:00 PM,CP,Darktrace Ltd (1250307D LN) - CEO Nicole Eagan: BTV Interview,BRITAIN
Deloitte LLP,3240627Z US,05/03/17,02:45:00 PM,CP,Deliotte LLP (3240627Z US) - CEO Cathy Engelbert: BTV Interview,UNITED STATES
Starwood Capital Group Managem,3858524Z US,05/03/17,02:45:00 PM,CP,Starwood Capital Group (3858524Z US) - CEO Barry Sternlicht: BTV Interview,UNITED STATES
Janus Capital Group Inc,JNS US,05/03/17,02:30:00 PM,CP,"Janus Capital Management (JNS) - Bill Gross, Fund Manager: BTW Interview",UNITED STATES
BlackRock Inc,BLK US,05/03/17,08:00:00 AM,CP,BlackRock (BLK US)- CIO Fixed Income Rick Rieder: BTV Interview,UNITED STATES
Revolution LLC,0120436D US,05/03/17,07:40:00 AM,CP,Revolution - CEO/CO-FOunder Steve Case : Bloomberg TV Interview,UNITED STATES
Vanguard Real Estate ETF,VNQ US,05/03/17,06:30:00 AM,CP,Vanguard (VNQ US) - CEO Bill McNabb  - Bloomberg TV Interview,UNITED STATES
General Electric Co,GE US,05/03/17,05:40:00 AM,CP,GE (GE US) - Chairman/CEO Jay Ireland : BTV Interview,UNITED STATES
UBS Group AG,UBSG SW,05/03/17,05:30:00 AM,CP,UBS (UBSG VX) - CIO Mark Haefele - Bloomberg TV Interview,SWITZERLAND
Allianz Global Investors Luxem,8234870Z LX,05/03/17,04:00:00 AM,CP,Allianz Global Investors (8234870Z LX) - CIO Andreas Utermann: BTV Interview,LUXEMBOURG
SL Green Realty Corp,SLG US,05/03/17,01:45:00 AM,CP,SL Green Reality (SLG US) CEO Marc Holliday: BTV Interview,UNITED STATES
Siemens AG,SIE GR,05/03/17,01:15:00 AM,CP,Siemens AG (SIE GR) - CFO Ralf Thomas: BTV Interview,GERMANY
HSBC Holdings PLC,HSBA LN,05/03/17,12:45:00 AM,CP,HSBC (HSBA LN) CFO Iain MacKay: BTV Interview,BRITAIN
UBS Group AG,UBSG SW,05/02/17,11:10:00 PM,CP,UBS (UBS US) - Head:Commodities / APAC FX Dominic Schneider: BTV Interview,SWITZERLAND
Atlantic Investment Management,0727922D US,05/02/17,07:30:00 PM,CP,Atlantic Investment Mngmt (0727922D US)-Founder/CIO Alex Roepers: BTV Interview,UNITED STATES
Twitter Inc,TWTR US,05/02/17,05:00:00 PM,CP,Twitter (TWTR US) - CFO/COO Mark Bertolini : BTV Interview,UNITED STATES
Aetna Inc,AET US,05/02/17,03:40:00 PM,CP,Aetna (AET US) - Chairman/CEO Mark Bertolini: BTV Interview,UNITED STATES
California State Teachers' Ret,53793Z US,05/02/17,03:05:00 PM,CP,Cal State TRS (53793Z US) - CIO Chris Ailman : Bloomberg TV Interview,UNITED STATES
Guggenheim Capital LLC,8925498Z US,05/02/17,02:30:00 PM,CP,Guggenheim (8925498Z US) - CIO Byron Scott Minerd : BTV Interview,UNITED STATES
Box Inc,BOX US,05/02/17,01:45:00 PM,CP,Box Inc. (BOX US) - CEO Aaron Levie: BTV Interview,UNITED STATES
Ernst & Young LLP,5092Z US,05/02/17,01:10:00 PM,CP,EY (5092Z US) - Chairman/CEO Mark Weinberger  : Bloomberg TV Interview,UNITED STATES
Carlyle Group Inc/The,CG US,05/02/17,12:45:00 PM,CP,Carlyle Group (CG US) - Co-Founder/Co-CEO David Rubenstein: BTV Interview,UNITED STATES
Colony Capital Inc,CLNY US,05/02/17,12:30:00 PM,CP,Colony (CLNS US) - Chairman Tom Barrack : Bloomberg TV Interview,UNITED STATES
Brookfield Asset Management In,BAM/A CN,05/02/17,11:15:00 AM,CP,Brookfield Asset Mgmt (BAM/A CN) - CEO Bruce Flatt  : Bloomberg TV Interview,CANADA
Canyon Capital Advisors LLC,830756Z US,05/02/17,10:30:00 AM,CP,Canyon Partners (830756Z US) - Co-CEO/Chairman Josh Friedman  : BTV Interview,UNITED STATES
Aberdeen Asset Management PLC,ADN LN,05/02/17,04:10:00 AM,CP,Aberdeen Asset Management (ADN LN) - CEO Martin James Gilbert : BTV Interview,BRITAIN
Pershing Square Holdings Ltd/F,PSH NA,05/02/17,02:10:00 AM,CP,"BTV Interview: Bill Ackman, CEO",GUERNSEY
Melco Resorts & Entertainment,MLCO US,05/01/17,07:10:00 PM,CP,"BTV Interview: Melco Resorts & Entertainment, CEO Lawrence Ho",HONG KONG
Dow Chemical Co/The,1697067D US,05/01/17,04:30:00 PM,CP,Dow Chemical (DOW US) -  Chairman Andre Liveris : BTV Interview,UNITED STATES
CME Group Inc,CME US,05/01/17,04:10:00 PM,CP,CME Group Inc. (CME US) - Chairman Terry Duffy: BTV Interview,UNITED STATES
Prudential Financial Inc,PRU US,05/01/17,03:30:00 PM,CP,Prudential Financial Inc. (PRU US) - CEO David Hunt: Bloomberg TV Interview,UNITED STATES
State Street Corp,STT US,05/01/17,03:00:00 PM,CP,State  Street (STT US)  - Chairman Joseph Hooley: BTV Interview,UNITED STATES
Citadel Enterprise Americas LL,578298Z US,05/01/17,02:30:00 PM,CP,Citadel LLC (578298Z US) - CEO Ken Griffin : Bloomberg TV Interview,UNITED STATES
Barings LLC,318944Z US,05/01/17,02:00:00 PM,CP,Barings (318944Z US) - CEO Tom Finke : BTV Interview,UNITED STATES
Nasdaq Inc,NDAQ US,05/01/17,01:45:00 PM,CP,Nasdaq (NDAQ US) - President and CEO Adena Friedman: BTV Interview,UNITED STATES
Independent Community Bankers,283936Z US,05/01/17,01:10:00 PM,CP,"ICBA (283936Z US) - Cam Fine, CEO: BTV Interview",UNITED STATES
Wells Fargo & Co,WFC US,05/01/17,11:10:00 AM,CP,Wells Fargo & Co (WFC US) - CEO Tim Sloan : Bloomberg TV Interview,UNITED STATES
Goldman Sachs Group Inc/The,GS US,05/01/17,10:15:00 AM,CP,Goldman Sachs (GS US) - President/COO David Solomon  : BTV Interview,UNITED STATES
Atlas Merchant Capital LLC,1226997D US,05/01/17,09:45:00 AM,CP,Atlas Merchant Capital (1226997D US) - CEO Bob Diamond: BTV Interview,UNITED STATES
Goldman Sachs & Co LLC,1903Z US,04/28/17,12:00:00 PM,CP,Goldman Sachs AM (1903Z US) - CIO Jonathan Beinner : Bloomberg TV Interview,UNITED STATES
Oaktree Capital Group LLC,OAK US,04/28/17,08:30:00 AM,CP,Oaktree Capital Group (OAK US) - Co-Chairman Howard Marks: BTV Interview,UNITED STATES
Committee On Capital Markets R,0854728D US,04/28/17,06:20:00 AM,CP,Capital Markets Regulation(0854728D US)-Director Hal Scott: BTV Interview,UNITED STATES
Council on Foreign Relations I,13596Z US,04/28/17,06:00:00 AM,CP,Council on Foreign Relations(13596Z US)-President Richard Haas: BTV Interview,UNITED STATES
Barclays PLC,BARC LN,04/28/17,02:05:00 AM,CP,Barclays (BARC LN) - CEO Jes Staley : Bloomberg TV Interview,BRITAIN
Danske Bank A/S,DANSKE DC,04/28/17,01:50:00 AM,CP,Danske Bank (DANSKE DC)- CFO Jacob Aarup-Anderson : BTV Interview,DENMARK
UBS AG,UBSN SW,04/28/17,01:45:00 AM,CP,UBS (UBSN SW) - CEO Sergio Ermotti : Bloomberg TV Interview,SWITZERLAND
Stockland,SGP AU,04/27/17,06:40:00 PM,CP,Stockland (SGP AU) - Residential CEO Andrew Whitson: BTV Interview,AUSTRALIA
PayPal Holdings Inc,PYPL US,04/27/17,05:10:00 PM,CP,BTV Interview: Paypal (PYPL US) CFO John Rainey,UNITED STATES
American Bankers Association I,0321782Z US,04/27/17,02:15:00 PM,CP,BTV Interview: Robert Nichols - President & CEO,UNITED STATES
United Parcel Service Inc,UPS US,04/27/17,11:15:00 AM,CP,UPS Inc (UPS US) - CFO Richard Peretz : Bloomberg TV Interview,UNITED STATES
TOTAL SE,FP FP,04/27/17,11:00:00 AM,CP,Total SA (FP FP) - CEO Patrick Pouyanne : Bloomberg TV Interview,FRANCE
Ford Motor Co,F US,04/27/17,07:15:00 AM,CP,Ford Motor Co (F US) - CEO Mark Fields : Bloomberg TV Interview,UNITED STATES
Business Roundtable,0321246Z US,04/27/17,07:00:00 AM,CP,"BTV Interview: Josh Bolton, CEO",UNITED STATES
Deutsche Boerse AG,DB1 GR,04/27/17,03:30:00 AM,CP,Deutsche Boerse (DB1 GR) - CFO Gregor Pottmeyer: BTV Interview,GERMANY
Roche Holding AG,ROG SW,04/27/17,03:10:00 AM,CP,Roche (ROG VX) - CEO Severin Schwan : BTV Interview,SWITZERLAND
Bayer AG,BAYN GR,04/27/17,03:00:00 AM,CP,Bayer Inc. (BAYN GR) - CEO Werner Baumann : BTV Interview,GERMANY
Nordea Bank AB,1657599D SS,04/27/17,01:10:00 AM,CP,BTV Interview: CEO Casper Von Koskull,SWEDEN
Nordea Bank Abp,NDA SS,04/27/17,01:10:00 AM,CP,BTV Interview: CEO Casper Von Koskull,FINLAND
Dropbox Inc,DBX US,04/26/17,05:00:00 PM,CP,Dropbox (4529280Z US) - CEO Drew Houston : Bloomberg TV Interview,UNITED STATES
Adecco Group AG,ADEN SW,04/26/17,04:30:00 AM,CP,Adecco Group (ADEN VX) - CEO Alain Dehaze : Bloomberg TV Interview,SWITZERLAND
Renault SA,RNO FP,04/26/17,04:30:00 AM,CP,Renault SA (RNO FP) - CEO/Chairman Carlos Ghosn: BTV Interview,FRANCE
Banco Santander SA,SAN SM,04/26/17,02:20:00 AM,CP,Banco Santander(SAN SM) - CFO  Jose Garcia Cantera : Bloomberg TV Interview,SPAIN
Credit Suisse Group AG,CSGN SW,04/26/17,01:50:00 AM,CP,Credit Suisse (CSGN VX) - CEO Tidjane Thiam : Bloomberg TV Interview,SWITZERLAND
IHS Markit Ltd,INFO US,04/26/17,12:10:00 AM,CP,IHS Markit Energy Group (INFO US) - Vice President Victor Shum: BTV Interview,BRITAIN
Ecognosis Advisory Co Ltd,1334081D HK,04/25/17,11:10:00 PM,CP,Ecognosis Advisory (1334081D HK) - CEO Andrew Freris: BTV Interview,HONG KONG
Honeywell International Inc,HON US,04/25/17,08:00:00 AM,CP,Honeywell (HON US) - CEO Dave Cote : Bloomberg TV Interview,UNITED STATES
Eli Lilly and Co,LLY US,04/25/17,07:45:00 AM,CP,Eli Lilly (LLY US) - CEO Dave Ricks : Bloomberg TV Interview,UNITED STATES
Ericsson AB,0257170D SS,04/25/17,05:40:00 AM,CP,Ericsson (0257170D SS) - CEO Borje Ekholm : Bloomberg TV Interview,SWEDEN
Volvo AB,VOLVB SS,04/25/17,04:30:00 AM,CP,Volvo (VOLVB SS) - CEO Martin Lundstedt : Bloomberg TV Interview,SWEDEN
SAP SE,SAP GR,04/25/17,02:45:00 AM,CP,SAP (SAP GR) - CFO Luka Mucic : Bloomberg TV Interview,GERMANY
Reliance Industries Ltd,RIL IN,04/24/17,09:00:00 AM,CP,"Reliance industries, CFO Sh Alok Agarwal; BTV Interview",INDIA
Koninklijke Philips NV,PHIA NA,04/24/17,01:30:00 AM,CP,KONINKLIJKE PHILIPS (PHIA NA) - CEO Frans Van Houten : BTV Interview,NETHERLANDS
Turk Hava Yollari AO,THYAO TI,04/23/17,10:10:00 PM,CP,Turkish Airlines  (THYAO TI) - CEO Bilal Eksi: BTV Interview,TURKEY
Sun Hung Kai Properties Ltd,16 HK,04/23/17,09:40:00 PM,CP,Sun Hung Kai  (16 HK) - CIO Sebastiaan van den Berg : BTV Interview,HONG KONG
Amplitude Capital AG,0313417D SW,04/21/17,07:00:00 AM,CP,Amplitude Capital(0313417D SW)-CEO/Chariman Karesten Schroeder:BTV Interview,SWITZERLAND
JPMorgan Chase & Co,JPM US,04/21/17,06:15:00 AM,CP,JPMorgan Chase (JPM US) - Chairman Jacob Frenkel : BTV Interview,UNITED STATES
Signify NV,LIGHT NA,04/21/17,01:30:00 AM,CP,Philips Lighting (LIGHT NA) - CEO Eric Rondolat : Bloomberg TV Interview,NETHERLANDS
European Investment Bank,654429Z LX,04/21/17,12:00:00 AM,CP,European Investment Bank(654429Z LX) - President Werner Hoyer : BTV Interview,LUXEMBOURG
TD Ameritrade Holding Corp,AMTD US,04/20/17,09:10:00 PM,CP,TD Ameritrade Asia (AMTD US) - CEO Christopher Brankin: BTV Interview,UNITED STATES
Loup Ventures Management LLC,1474747D US,04/20/17,07:40:00 PM,CP,Loup Ventures (1474747D US) - Co-Founder Gene Munster : BTV Interview,UNITED STATES
Baidu Inc,BIDU US,04/20/17,05:30:00 PM,CP,Baidu (BIDU US) - President Zhang Ya-Qin : Bloomberg TV Interview,CHINA
Capital Fund Management SA,0280124D FP,04/20/17,03:00:00 PM,CP,Capital Fund Management SA (0280124D FP)-President Philipe Jordan:BTV Interview,FRANCE
Virtu Financial Inc,VIRT US,04/20/17,02:00:00 PM,CP,Virtu Financial (VIRT US) - CEO Doug Cifu: BTV Interview,UNITED STATES
Invemed Associates Inc,2967110Z US,04/20/17,08:00:00 AM,CP,Invemed Associates Inc (2967110Z US) - Chairman Ken Langone: BTV Interview,UNITED STATES
Federal Reserve Bank of Dallas,2972922Z US,04/20/17,07:30:00 AM,CP,FederalReserveBankofDallas(2972922Z US)President Robert Kaplan : BTV Interview,UNITED STATES
Berkshire Hathaway Inc,BRK/A US,04/19/17,07:40:00 PM,CP,Berkshire Hathaway (BRK US) Senior VP Peter Turtzo: BTV Interview,UNITED STATES
Pacific Investment Management,21429Z US,04/19/17,10:00:00 AM,CP,PIMCO (21429Z US) - CIO Credit Mark Kiesel : BTV Interview,UNITED STATES
BlackRock Financial Management,339788Z US,04/19/17,07:00:00 AM,CP,BlackRock Financial Management  (339788Z US ) - CEO Larry Fink : BTV Interview,UNITED STATES
NIO Co Ltd,1315651D CH,04/19/17,12:10:00 AM,CP,NextEv Inc. (1315651D CH) - CEO Padmasree Warrior: BTV Interview,CHINA
FCA Canada Inc,0249616D CN,04/18/17,10:10:00 PM,CP,Maserati/Alfa Romeo (0249616D CN) - CEO Reid Bigland: BTV Interview,CANADA
Facebook Inc,FB US,04/18/17,04:15:00 PM,CP,Facebook (FB US) - VP:Messaging Products David Marcus : BTV Interview,UNITED STATES
Los Angeles Clippers,0708145D US,04/18/17,02:40:00 PM,CP,Los Angeles Clippers (0708145D US) - Owner Steve Ballmer : BTV Interview,UNITED STATES
Tellurian Inc,TELL US,04/18/17,12:30:00 PM,CP,Tellurian- Chairman Charif Souki : BTV Interview,UNITED STATES
Akzo Nobel NV,AKZA NA,04/18/17,03:35:00 AM,CP,Akzo Nobel  (AKZA NA) - CEO Ton Buchner  : Bloomberg TV Interview,NETHERLANDS
Ford Motor Co,F US,04/18/17,02:20:00 AM,CP,Ford Motor Co (F US) - CEO Kumar Galhotra  : Bloomberg TV Interview,UNITED STATES
Guggenheim Capital LLC,8925498Z US,04/17/17,03:30:00 PM,CP,Guggenheim (8925498Z US) - CIO Byron Scott Minerd : BTV Interview,UNITED STATES
OppenheimerFunds Inc,44553Z US,04/17/17,02:00:00 PM,CP,Oppenheimer Funds (3885702Z US) - CEO Art Steinmetz : BTV Interview,UNITED STATES
Muddy Waters LLC,9170707Z US,04/17/17,11:30:00 AM,CP,Muddy Waters LLC (9170707Z US)- Founder Carson Block: BTV Interview,UNITED STATES
Patterson-UTI Energy Inc,PTEN US,04/17/17,07:40:00 AM,CP,Patterson-UTI Energy - Chairman Mark Seigel: Bloomberg TV Interview,UNITED STATES
Revolution LLC,0120436D US,04/17/17,06:00:00 AM,CP,Revolution - CEO Steve Case : Bloomberg TV Interview,UNITED STATES
Wells Fargo & Co,WFC US,04/13/17,04:00:00 PM,CP,Wells Fargo & Co (WFC US) - CFO John R Shrewsberry : Bloomberg TV Interview,UNITED STATES
Halcyon Event-Driven Managemen,2734282Z US,04/13/17,12:00:00 PM,CP,"Jason Dillow - CIO Halcyon Capital Mgmt, US Voices: TV Interview",UNITED STATES
Eni SpA,ENI IM,04/13/17,11:00:00 AM,CP,Eni (ENI IM) - CEO Claudio Descalzi : Bloomberg TV Interview,ITALY
National Australia Bank Ltd,NAB AU,04/12/17,11:10:00 PM,CP,Oreana Private Wealth (NAB AU) - CIO Norman Chan: BTV Interview,AUSTRALIA
PRC Macro Ltd,1269535D CH,04/12/17,10:10:00 PM,CP,PRC Macro (1269535D CH) - Co-CEO Gao Song: BTV Interview,CHINA
RHL Ventures Sdn Bhd,1465958D MK,04/12/17,09:40:00 PM,CP,RHL Ventures (1465958D MK ) - Co-Founder Rachel Lau: BTV Interview,MALAYSIA
Quantopian Inc,0876813D US,04/12/17,02:10:00 PM,CP,Quantopian (0876813D US) - CEO/Founder John Fawcett : BTV Interview,UNITED STATES
Ford Motor Co,F US,04/12/17,09:20:00 AM,CP,Ford Motor Co (F US) - CEO Mark Fields : Bloomberg TV Interview,UNITED STATES
Volkswagen Group of America In,7834Z US,04/12/17,08:40:00 AM,CP,Audi Of America (0282151D US) - CEO Scott Keogh: BTV Interview,UNITED STATES
Automobili Lamborghini SpA,LAM IM,04/11/17,12:50:00 PM,CP,Automobili Lamborghini SpA (LAM IM)-COO Alessandro Farmeschi:BTV Interview,ITALY
Blackstone Group Inc/The,BX US,04/11/17,12:00:00 PM,CP,Blackstone Group (BX US) - CEO Stephen Schwarzman : Bloomberg TV Interview,UNITED STATES
Loomis Sayles Bond Fund,LSBDX US,04/11/17,10:00:00 AM,CP,Loomis Sayles (LSBDX US) - Vice Chairman Dan Fuss : BTV Interview,UNITED STATES
SVB Financial Group,SIVB US,04/11/17,04:50:00 AM,CP,SVB Financial Group (SIVB US) - CEO Gregory Becker : BTV Interview,UNITED STATES
Suncorp Group Ltd,SUN AU,04/10/17,04:10:00 PM,CP,"BTV Interview: Steven Milch, Chief Economist",AUSTRALIA
Research Affiliates LLC,3883706Z US,04/10/17,02:50:00 PM,CP,Research Affiliates (3883706Z US) - CEO Rob Arnott : Bloomberg TV Interview,UNITED STATES
Laffer Investments Inc,3857156Z US,04/10/17,10:00:00 AM,CP,Laffer Investments (3857156Z US) -Chairman/Founder Arthur Laffer: BTV Interview,UNITED STATES
Toyota Motor Manufacturing Ken,0131292D US,04/10/17,07:45:00 AM,CP,Toyota Motor Manufacturing (0131292D US) - Pres. Wil James : BTV Interview,UNITED STATES
Chenavari Credit Partners LLP,0227914D LN,04/10/17,04:00:00 AM,CP,Chenavari (0227914D LN) - CEO Loic Fery : Bloomberg TV Interview,BRITAIN
JPMorgan Chase & Co,JPM US,04/09/17,08:10:00 PM,CP,JPMorgan Chase (JPM US) - Chief China Economist Haibin Zhu : BTV Interview,UNITED STATES
Federal Reserve Bank of St Lou,2972882Z US,04/09/17,07:10:00 PM,CP,Fed. Reserve Bank of St Louis/MO (2972882Z US)-Pres James Bullard:BTV Interview,UNITED STATES
Ford Motor Co,F US,04/09/17,06:00:00 PM,CP,Ford Motor Co (F US) - CEO Mark Fields : Bloomberg TV Interview,UNITED STATES
Diane von Furstenberg Studio L,0302038Z US,04/07/17,04:50:00 PM,CP,DVF Studio LP(0302038Z US)-Chairman/Founder Diane Von Furstenberg:BTV Interview,UNITED STATES
23andMe Inc,8142214Z US,04/07/17,12:45:00 PM,CP,"23andMe (8142214Z US) - CEO, Co Founder Anne Wojcicki : Bloomberg TV Interview",UNITED STATES
